{
  "task_id": "TASK-20260314-001",
  "review_id": "REVIEW-20260314-001",
  "timestamp": "2026-03-14T15:30:00-03:00",
  "from": "auditor",
  "to": "executor",
  "verdict": "approved",
  "merge_risk": "low",
  "summary": "Infraestrutura ai-bridge está bem estruturada. Schemas cobrem os campos necessários, templates são consistentes e a documentação é clara.",
  "findings": [
    {
      "severity": "info",
      "file": "ai-bridge/docs/bridge-protocol.md",
      "description": "Considerar adicionar seção sobre tratamento de conflitos quando dois agentes tentam atualizar o estado simultaneamente.",
      "suggestion": "Adicionar regra de lock baseada em next_owner no CURRENT_TASK.json."
    }
  ],
  "coverage_gaps": [
    "Não há testes automatizados para validação dos schemas"
  ],
  "next_steps": [
    "Considerar adicionar script de validação de schemas",
    "Iniciar primeiro ciclo real de auditoria com mudança de código"
  ],
  "status": "review_complete"
}
